{
  "schemaVersion": 1,
  "generatedAt": "2026-07-28T20:04:27.484Z",
  "sourceHash": "f9379efd0c4715235efb68907accbe0d2c30fe00b1aee7e1632f1a6378023d04",
  "modules": [
    {
      "id": "library",
      "path": "app/features/library",
      "purpose": "Owns library capability",
      "owns": [
        "library"
      ],
      "dependencies": []
    },
    {
      "id": "reference",
      "path": "app/features/reference",
      "purpose": "Owns reference capability",
      "owns": [
        "reference"
      ],
      "dependencies": []
    },
    {
      "id": "server",
      "path": "server",
      "purpose": "Owns server capability",
      "owns": [
        "server"
      ],
      "dependencies": []
    },
    {
      "id": "shared",
      "path": "shared",
      "purpose": "Owns shared capability",
      "owns": [
        "shared"
      ],
      "dependencies": []
    },
    {
      "id": "tasks",
      "path": "app/features/tasks",
      "purpose": "Owns tasks capability",
      "owns": [
        "tasks"
      ],
      "dependencies": []
    }
  ],
  "edges": [
    {
      "from": "server",
      "to": "shared",
      "kind": "imports"
    },
    {
      "from": "tasks",
      "to": "library",
      "kind": "imports"
    },
    {
      "from": "tasks",
      "to": "shared",
      "kind": "imports"
    }
  ]
}
